test_id,timestamp,date,url,method,model,input_est_chars,output_chars,truncated,truncation_char_num,tokens_est,hypothesis_match,notes,copilot_version,file_size_bytes,md5_checksum,total_lines,total_words,code_blocks,table_rows,headers
BL-1,2026-03-24T16:59:48.990844,2026-03-24,https://www.mongodb.com/docs/manual/reference/change-events/create/,vscode-chat,Auto - Claude Haiku 4.5,87040,24500,yes,24500,6125,H1-yes,"Auto model selected Claude Haiku 4.5. Used fetch_webpage tool (strips CSS/JS, converts to markdown). Expected ~85KB, received ~24-25KB (29% of expected). Truncated mid-object in JSON example — dangling commas and unclosed braces. Multiple unclosed code blocks. Footer/sitemap content mixed in. Content deduplicated across repeated headers.",0.40.1,,,,,,,
BL-1,2026-03-24T17:30:05.032514,2026-03-24,https://www.mongodb.com/docs/manual/reference/change-events/create/,vscode-chat,Auto (unknown),87040,0,no,,0,EC-timeout,"Run failed. Skipped pylanceRunCodeSnippet MCP tool prompt, agent then attempted local code execution path, timed out with 'Sorry, no response was returned.' No content retrieved. Tool attempted: pylanceRunCodeSnippet (skipped by user). Not a valid data point for truncation analysis.",0.40.1,,,,,,,
BL-1,2026-03-24T17:53:28.917441,2026-03-24,https://www.mongodb.com/docs/manual/reference/change-events/create/,vscode-chat,Auto - Raptor mini (Preview),87040,4500,yes,4500,1125,H1-yes,"Auto routing selected Raptor mini (Preview) — different model from run 1 (Claude Haiku 4.5) on identical prompt. Used fetch_webpage tool. Received ~4,500 chars vs ~24,500 in run 1 — significant variance across models on same URL. Evidence of truncation: repeated ... markers, ellipsis segments, abrupt final ... after footer. Likely truncated by fetch_webpage response size limit. Content is rendered extraction overlay with links/markup, not clean markdown. No infrastructure details exposed beyond fetch_webpage tool name.",0.40.1,,,,,,,
BL-1,2026-03-24T17:58:51.346955,2026-03-24,https://www.mongodb.com/docs/manual/reference/change-events/create/,vscode-chat,Auto - Raptor mini (Preview),87040,3200,yes,3200,800,H1-yes,"Auto routing selected Raptor mini (Preview). Updated prompt included explicit guardrails against local code execution — agent still attempted pylanceRunCodeSnippet (skipped by user). After skip, completed via fetch_webpage only. Character count not determinable exactly due to ... abbreviation in tool output; visible snippet ~3,200 chars by eyeball. Truncation confirmed: repeated ... markers, cut-off at beginning/middle/end of tool output. Secondary tool call attempt logged: mcp_pylance_mcp_s_pylanceRunCodeSnippet (skipped by environment). fetch_webpage identified as sole successful tool.",0.40.1,,,,,,,
BL-1,2026-03-24T18:24:36.525634,2026-03-24,https://www.mongodb.com/docs/manual/reference/change-events/create/,vscode-chat,Auto - Raptor mini (Preview),87040,8750,yes,8750,2200,H1-yes,"Auto routing selected Raptor mini (Preview). No pylanceRunCodeSnippet attempt this run. Used fetch_webpage only. Exact char count unavailable due to summarized tool output format; agent estimates 7,500-10,000 chars (midpoint 8,750 used). Token estimate 1,900-2,500 (midpoint 2,200 used). Truncation confirmed: repeated ... ellipses beginning/middle/end, page ends with navigation/footer not doc content. Last visible sequence: '# create Event' followed by '...'. Content is rendered extraction with partial HTML-to-text styling, not raw markdown. Server domains visible in returned text: www.mongodb.com, webimages.mongodb.com. No secondary tool call attempted this run.",0.40.1,,,,,,,
